{
  "artifacts": [
    {
      "path": "trade-history.csv",
      "role": "TRADE_HISTORY",
      "sha256": "824549308705cd41212b3f33dcb895b79d2b154e7e13bc6c82cf10600b995b4f",
      "sizeBytes": 308
    },
    {
      "path": "position-history.csv",
      "role": "POSITION_HISTORY",
      "sha256": "abc3858045012f66d163007be6ad454346790939e4ac375a403ab28eb2a3eb8e",
      "sizeBytes": 208
    }
  ],
  "declaredPositionMode": "ONE_WAY",
  "description": "지원하지 않는 COIN-M product family",
  "expectedCanonicalRecordCount": 0,
  "expectedEligibleEpisodeCount": 0,
  "expectedEpisodeCount": 0,
  "expectedExcludedEpisodeCount": 0,
  "expectedFailureCode": "UNSUPPORTED_PRODUCT",
  "expectedImportStatus": "REJECTED",
  "expectedReconciliationStatuses": [],
  "fixtureId": "unsupported-coin-m",
  "instrumentTerms": {
    "contractMultiplier": {
      "scale": 0,
      "unscaled": "1"
    },
    "settlementPrecision": 2,
    "stepSize": {
      "scale": 0,
      "unscaled": "1"
    },
    "tickSize": {
      "scale": 2,
      "unscaled": "1"
    }
  },
  "normalizerVersion": "fixture-v1",
  "productFamily": "INVERSE_PERPETUAL",
  "reconstructionPolicyVersion": "BINANCE_USDS_LINEAR_PERPETUAL_ONE_WAY_V1",
  "reviewTimezone": "Asia/Seoul",
  "schemaVersion": "1.0.0",
  "settlementAsset": "BTC",
  "sourceDialect": {
    "positionHistory": "BINANCE_USDS_POSITION_HISTORY_V1",
    "tradeHistory": "BINANCE_USDS_TRADE_HISTORY_V1"
  },
  "sourceTimezone": "Asia/Seoul",
  "tags": [
    "REJECTED_IMPORT",
    "SYNTHETIC",
    "NON_PRODUCTION"
  ]
}
