{
  "artifacts": [
    {
      "path": "trade-history.csv",
      "role": "TRADE_HISTORY",
      "sha256": "9b9f07306590cc1d58127fff6dab4eb2affe578c82b25e490bf8176f9b6dcfd7",
      "sizeBytes": 419
    },
    {
      "path": "position-history.csv",
      "role": "POSITION_HISTORY",
      "sha256": "7c34990995649fc55a0faf9494939945219945e213fad072cb87eb483b142c09",
      "sizeBytes": 294
    }
  ],
  "declaredPositionMode": "ONE_WAY",
  "description": "One-way allocation으로 설명할 수 없는 Long/Short overlap",
  "expectedCanonicalRecordCount": 0,
  "expectedEligibleEpisodeCount": 0,
  "expectedEpisodeCount": 0,
  "expectedExcludedEpisodeCount": 0,
  "expectedFailureCode": "UNSUPPORTED_POSITION_MODE",
  "expectedImportStatus": "REJECTED",
  "expectedReconciliationStatuses": [],
  "fixtureId": "hedge-overlap",
  "instrumentTerms": {
    "contractMultiplier": {
      "scale": 0,
      "unscaled": "1"
    },
    "settlementPrecision": 2,
    "stepSize": {
      "scale": 0,
      "unscaled": "1"
    },
    "tickSize": {
      "scale": 2,
      "unscaled": "1"
    }
  },
  "normalizerVersion": "fixture-v1",
  "productFamily": "LINEAR_PERPETUAL",
  "reconstructionPolicyVersion": "BINANCE_USDS_LINEAR_PERPETUAL_ONE_WAY_V1",
  "reviewTimezone": "Asia/Seoul",
  "schemaVersion": "1.0.0",
  "settlementAsset": "USDT",
  "sourceDialect": {
    "positionHistory": "BINANCE_USDS_POSITION_HISTORY_V1",
    "tradeHistory": "BINANCE_USDS_TRADE_HISTORY_V1"
  },
  "sourceTimezone": "Asia/Seoul",
  "tags": [
    "REJECTED_IMPORT",
    "SYNTHETIC",
    "NON_PRODUCTION"
  ]
}
