{
  "artifacts": [
    {
      "path": "trade-history.csv",
      "role": "TRADE_HISTORY",
      "sha256": "bd7098b0f75ce111a4d460c5ecd03ba0cf62ff45c81880baaba1636850b9afeb",
      "sizeBytes": 424
    },
    {
      "path": "position-history.csv",
      "role": "POSITION_HISTORY",
      "sha256": "9543acfc3b7f75ac69c90c2872c84b4415032e241adfd496555109a5de5b02bb",
      "sizeBytes": 209
    }
  ],
  "declaredPositionMode": "ONE_WAY",
  "description": "동일 timestamp의 execution을 숫자 Trade ID로 정렬",
  "expectedCanonicalRecordCount": 10,
  "expectedEligibleEpisodeCount": 1,
  "expectedEpisodeCount": 1,
  "expectedExcludedEpisodeCount": 0,
  "expectedFailureCode": null,
  "expectedImportStatus": "ACCEPTED",
  "expectedReconciliationStatuses": [
    "EXACT"
  ],
  "fixtureId": "same-timestamp-multiple-trades",
  "instrumentTerms": {
    "contractMultiplier": {
      "scale": 0,
      "unscaled": "1"
    },
    "settlementPrecision": 2,
    "stepSize": {
      "scale": 0,
      "unscaled": "1"
    },
    "tickSize": {
      "scale": 2,
      "unscaled": "1"
    }
  },
  "normalizerVersion": "fixture-v1",
  "productFamily": "LINEAR_PERPETUAL",
  "reconstructionPolicyVersion": "BINANCE_USDS_LINEAR_PERPETUAL_ONE_WAY_V1",
  "reviewTimezone": "Asia/Seoul",
  "schemaVersion": "1.0.0",
  "settlementAsset": "USDT",
  "sourceDialect": {
    "positionHistory": "BINANCE_USDS_POSITION_HISTORY_V1",
    "tradeHistory": "BINANCE_USDS_TRADE_HISTORY_V1"
  },
  "sourceTimezone": "Asia/Seoul",
  "tags": [
    "ACCEPTED_ELIGIBLE",
    "SYNTHETIC",
    "NON_PRODUCTION"
  ]
}
