{
  "artifacts": [
    {
      "path": "trade-history.csv",
      "role": "TRADE_HISTORY",
      "sha256": "5a30b5a99fb20b86014dfce9255a041b7d53c4986f00240325c9f299fc8f0fc0",
      "sizeBytes": 419
    },
    {
      "path": "position-history.csv",
      "role": "POSITION_HISTORY",
      "sha256": "fa04afba8c5e82f0902076c2de22eb0d19d826756d6f90e0b2e3d58343772c17",
      "sizeBytes": 209
    }
  ],
  "declaredPositionMode": "ONE_WAY",
  "description": "분할 진입 후 전량 청산",
  "expectedCanonicalRecordCount": 10,
  "expectedEligibleEpisodeCount": 1,
  "expectedEpisodeCount": 1,
  "expectedExcludedEpisodeCount": 0,
  "expectedFailureCode": null,
  "expectedImportStatus": "ACCEPTED",
  "expectedReconciliationStatuses": [
    "EXACT"
  ],
  "fixtureId": "partial-entry",
  "instrumentTerms": {
    "contractMultiplier": {
      "scale": 0,
      "unscaled": "1"
    },
    "settlementPrecision": 2,
    "stepSize": {
      "scale": 0,
      "unscaled": "1"
    },
    "tickSize": {
      "scale": 2,
      "unscaled": "1"
    }
  },
  "normalizerVersion": "fixture-v1",
  "productFamily": "LINEAR_PERPETUAL",
  "reconstructionPolicyVersion": "BINANCE_USDS_LINEAR_PERPETUAL_ONE_WAY_V1",
  "reviewTimezone": "Asia/Seoul",
  "schemaVersion": "1.0.0",
  "settlementAsset": "USDT",
  "sourceDialect": {
    "positionHistory": "BINANCE_USDS_POSITION_HISTORY_V1",
    "tradeHistory": "BINANCE_USDS_TRADE_HISTORY_V1"
  },
  "sourceTimezone": "Asia/Seoul",
  "tags": [
    "ACCEPTED_ELIGIBLE",
    "SYNTHETIC",
    "NON_PRODUCTION"
  ]
}
