{
  "artifacts": [
    {
      "path": "trade-history.csv",
      "role": "TRADE_HISTORY",
      "sha256": "e6a165b6e5a5c9509842fec07cbb0850970c1c76db36ab00844cac5e2548b21c",
      "sizeBytes": 421
    },
    {
      "path": "position-history.csv",
      "role": "POSITION_HISTORY",
      "sha256": "22853ddf6310fd1a8de209a4379dd0e7d7c2a3c3ae8bd8754b33d0dbc2e472cc",
      "sizeBytes": 292
    }
  ],
  "declaredPositionMode": "ONE_WAY",
  "description": "하나의 SELL execution이 Long을 닫고 Short를 시작",
  "expectedCanonicalRecordCount": 11,
  "expectedEligibleEpisodeCount": 2,
  "expectedEpisodeCount": 2,
  "expectedExcludedEpisodeCount": 0,
  "expectedFailureCode": null,
  "expectedImportStatus": "ACCEPTED",
  "expectedReconciliationStatuses": [
    "EXACT"
  ],
  "fixtureId": "long-to-short-reversal",
  "instrumentTerms": {
    "contractMultiplier": {
      "scale": 0,
      "unscaled": "1"
    },
    "settlementPrecision": 2,
    "stepSize": {
      "scale": 0,
      "unscaled": "1"
    },
    "tickSize": {
      "scale": 2,
      "unscaled": "1"
    }
  },
  "normalizerVersion": "fixture-v1",
  "productFamily": "LINEAR_PERPETUAL",
  "reconstructionPolicyVersion": "BINANCE_USDS_LINEAR_PERPETUAL_ONE_WAY_V1",
  "reviewTimezone": "Asia/Seoul",
  "schemaVersion": "1.0.0",
  "settlementAsset": "USDT",
  "sourceDialect": {
    "positionHistory": "BINANCE_USDS_POSITION_HISTORY_V1",
    "tradeHistory": "BINANCE_USDS_TRADE_HISTORY_V1"
  },
  "sourceTimezone": "Asia/Seoul",
  "tags": [
    "ACCEPTED_ELIGIBLE",
    "SYNTHETIC",
    "NON_PRODUCTION"
  ]
}
