{
  "artifacts": [
    {
      "path": "trade-history.csv",
      "role": "TRADE_HISTORY",
      "sha256": "8ae93fdf828ae78e57a6d36f685654ce585dacaba4da043fd374459cdc0a5097",
      "sizeBytes": 312
    },
    {
      "path": "position-history.csv",
      "role": "POSITION_HISTORY",
      "sha256": "68366e161ec9aec42b2f3b8752f4562d53d1b833b41402e59ccc8fc4a8a88d90",
      "sizeBytes": 209
    }
  ],
  "declaredPositionMode": "ONE_WAY",
  "description": "Trade realized profit와 Position closing PNL tolerance 초과",
  "expectedCanonicalRecordCount": 7,
  "expectedEligibleEpisodeCount": 0,
  "expectedEpisodeCount": 1,
  "expectedExcludedEpisodeCount": 1,
  "expectedFailureCode": null,
  "expectedImportStatus": "ACCEPTED",
  "expectedReconciliationStatuses": [
    "SUMMARY_MISMATCH"
  ],
  "fixtureId": "position-pnl-mismatch",
  "instrumentTerms": {
    "contractMultiplier": {
      "scale": 0,
      "unscaled": "1"
    },
    "settlementPrecision": 2,
    "stepSize": {
      "scale": 0,
      "unscaled": "1"
    },
    "tickSize": {
      "scale": 2,
      "unscaled": "1"
    }
  },
  "normalizerVersion": "fixture-v1",
  "productFamily": "LINEAR_PERPETUAL",
  "reconstructionPolicyVersion": "BINANCE_USDS_LINEAR_PERPETUAL_ONE_WAY_V1",
  "reviewTimezone": "Asia/Seoul",
  "schemaVersion": "1.0.0",
  "settlementAsset": "USDT",
  "sourceDialect": {
    "positionHistory": "BINANCE_USDS_POSITION_HISTORY_V1",
    "tradeHistory": "BINANCE_USDS_TRADE_HISTORY_V1"
  },
  "sourceTimezone": "Asia/Seoul",
  "tags": [
    "ACCEPTED_EXCLUDED",
    "SYNTHETIC",
    "NON_PRODUCTION"
  ]
}
