{
  "artifacts": [
    {
      "path": "trade-history.csv",
      "role": "TRADE_HISTORY",
      "sha256": "53cb0e2615b42f8c68f66228242e079b80e3e38f069f5322f34a0a852cb11a6e",
      "sizeBytes": 312
    },
    {
      "path": "position-history.csv",
      "role": "POSITION_HISTORY",
      "sha256": "9543acfc3b7f75ac69c90c2872c84b4415032e241adfd496555109a5de5b02bb",
      "sizeBytes": 209
    }
  ],
  "declaredPositionMode": "ONE_WAY",
  "description": "단일 Long 진입 후 전량 청산",
  "expectedCanonicalRecordCount": 7,
  "expectedEligibleEpisodeCount": 1,
  "expectedEpisodeCount": 1,
  "expectedExcludedEpisodeCount": 0,
  "expectedFailureCode": null,
  "expectedImportStatus": "ACCEPTED",
  "expectedReconciliationStatuses": [
    "EXACT"
  ],
  "fixtureId": "simple-long",
  "instrumentTerms": {
    "contractMultiplier": {
      "scale": 0,
      "unscaled": "1"
    },
    "settlementPrecision": 2,
    "stepSize": {
      "scale": 0,
      "unscaled": "1"
    },
    "tickSize": {
      "scale": 2,
      "unscaled": "1"
    }
  },
  "normalizerVersion": "fixture-v1",
  "productFamily": "LINEAR_PERPETUAL",
  "reconstructionPolicyVersion": "BINANCE_USDS_LINEAR_PERPETUAL_ONE_WAY_V1",
  "reviewTimezone": "Asia/Seoul",
  "schemaVersion": "1.0.0",
  "settlementAsset": "USDT",
  "sourceDialect": {
    "positionHistory": "BINANCE_USDS_POSITION_HISTORY_V1",
    "tradeHistory": "BINANCE_USDS_TRADE_HISTORY_V1"
  },
  "sourceTimezone": "Asia/Seoul",
  "tags": [
    "ACCEPTED_ELIGIBLE",
    "SYNTHETIC",
    "NON_PRODUCTION"
  ]
}
