{
  "artifacts": [
    {
      "path": "trade-history.csv",
      "role": "TRADE_HISTORY",
      "sha256": "4adfc1c8ffe5b5b59bffd4f79c1a1329edc7daf8cf496795ed72bc7459ff957d",
      "sizeBytes": 312
    },
    {
      "path": "position-history.csv",
      "role": "POSITION_HISTORY",
      "sha256": "26d94049d8b7d77fcf882488f91a078cf298e85dfc709841d33f6482bb8117f6",
      "sizeBytes": 210
    }
  ],
  "declaredPositionMode": "ONE_WAY",
  "description": "단일 Short 진입 후 전량 청산",
  "expectedCanonicalRecordCount": 7,
  "expectedEligibleEpisodeCount": 1,
  "expectedEpisodeCount": 1,
  "expectedExcludedEpisodeCount": 0,
  "expectedFailureCode": null,
  "expectedImportStatus": "ACCEPTED",
  "expectedReconciliationStatuses": [
    "EXACT"
  ],
  "fixtureId": "simple-short",
  "instrumentTerms": {
    "contractMultiplier": {
      "scale": 0,
      "unscaled": "1"
    },
    "settlementPrecision": 2,
    "stepSize": {
      "scale": 0,
      "unscaled": "1"
    },
    "tickSize": {
      "scale": 2,
      "unscaled": "1"
    }
  },
  "normalizerVersion": "fixture-v1",
  "productFamily": "LINEAR_PERPETUAL",
  "reconstructionPolicyVersion": "BINANCE_USDS_LINEAR_PERPETUAL_ONE_WAY_V1",
  "reviewTimezone": "Asia/Seoul",
  "schemaVersion": "1.0.0",
  "settlementAsset": "USDT",
  "sourceDialect": {
    "positionHistory": "BINANCE_USDS_POSITION_HISTORY_V1",
    "tradeHistory": "BINANCE_USDS_TRADE_HISTORY_V1"
  },
  "sourceTimezone": "Asia/Seoul",
  "tags": [
    "ACCEPTED_ELIGIBLE",
    "SYNTHETIC",
    "NON_PRODUCTION"
  ]
}
