{
  "artifacts": [
    {
      "path": "trade-history.csv",
      "role": "TRADE_HISTORY",
      "sha256": "eb93b35cc379982a3039ef9f203f964062c9f439760b1e6769cacc18dd6ce825",
      "sizeBytes": 200
    },
    {
      "path": "position-history.csv",
      "role": "POSITION_HISTORY",
      "sha256": "6ebdf9cc0da0c08ed54bbd089803a9aebdb5ad462425b0ab8fd54d82c98dc7e9",
      "sizeBytes": 125
    }
  ],
  "declaredPositionMode": "ONE_WAY",
  "description": "Trade ID header가 지원하지 않는 이름으로 변경됨",
  "expectedCanonicalRecordCount": 0,
  "expectedEligibleEpisodeCount": 0,
  "expectedEpisodeCount": 0,
  "expectedExcludedEpisodeCount": 0,
  "expectedFailureCode": "UNSUPPORTED_SOURCE_SCHEMA",
  "expectedImportStatus": "REJECTED",
  "expectedReconciliationStatuses": [],
  "fixtureId": "unsupported-source-schema",
  "instrumentTerms": {
    "contractMultiplier": {
      "scale": 0,
      "unscaled": "1"
    },
    "settlementPrecision": 2,
    "stepSize": {
      "scale": 0,
      "unscaled": "1"
    },
    "tickSize": {
      "scale": 2,
      "unscaled": "1"
    }
  },
  "normalizerVersion": "fixture-v1",
  "productFamily": "LINEAR_PERPETUAL",
  "reconstructionPolicyVersion": "BINANCE_USDS_LINEAR_PERPETUAL_ONE_WAY_V1",
  "reviewTimezone": "Asia/Seoul",
  "schemaVersion": "1.0.0",
  "settlementAsset": "USDT",
  "sourceDialect": {
    "positionHistory": "BINANCE_USDS_POSITION_HISTORY_V1",
    "tradeHistory": "BINANCE_USDS_TRADE_HISTORY_V1"
  },
  "sourceTimezone": "Asia/Seoul",
  "tags": [
    "REJECTED_IMPORT",
    "SYNTHETIC",
    "NON_PRODUCTION"
  ]
}
